results/feature_importance.json

[
  {
    "feature": "service_eco_i",
    "importance": 0.193855
  },
  {
    "feature": "service_telnet",
    "importance": 0.124211
  },
  {
    "feature": "service_smtp",
    "importance": 0.105766
  },
  {
    "feature": "flag_S0",
    "importance": 0.085001
  },
  {
    "feature": "dst_host_serror_rate",
    "importance": 0.051347
  },
  {
    "feature": "num_failed_logins",
    "importance": 0.036584
  },
  {
    "feature": "count",
    "importance": 0.035842
  },
  {
    "feature": "root_shell",
    "importance": 0.034252
  },
  {
    "feature": "service_domain_u",
    "importance": 0.026761
  },
  {
    "feature": "is_guest_login",
    "importance": 0.024566
  },
  {
    "feature": "protocol_type_icmp",
    "importance": 0.023199
  },
  {
    "feature": "service_other",
    "importance": 0.020782
  },
  {
    "feature": "service_ecr_i",
    "importance": 0.01805
  },
  {
    "feature": "dst_host_srv_count",
    "importance": 0.017484
  },
  {
    "feature": "wrong_fragment",
    "importance": 0.01531
  },
  {
    "feature": "dst_bytes",
    "importance": 0.015187
  },
  {
    "feature": "service_http",
    "importance": 0.014094
  },
  {
    "feature": "dst_host_diff_srv_rate",
    "importance": 0.013237
  },
  {
    "feature": "service_ftp_data",
    "importance": 0.011012
  },
  {
    "feature": "src_bytes",
    "importance": 0.010943
  },
  {
    "feature": "diff_srv_rate",
    "importance": 0.010311
  },
  {
    "feature": "num_file_creations",
    "importance": 0.010185
  },
  {
    "feature": "num_access_files",
    "importance": 0.007881
  },
  {
    "feature": "hot",
    "importance": 0.007324
  },
  {
    "feature": "protocol_type_udp",
    "importance": 0.006716
  },
  {
    "feature": "urgent",
    "importance": 0.006178
  },
  {
    "feature": "service_urp_i",
    "importance": 0.006039
  },
  {
    "feature": "flag_RSTR",
    "importance": 0.005966
  },
  {
    "feature": "flag_RSTOS0",
    "importance": 0.005082
  },
  {
    "feature": "dst_host_count",
    "importance": 0.004764
  },
  {
    "feature": "service_imap4",
    "importance": 0.00468
  },
  {
    "feature": "dst_host_rerror_rate",
    "importance": 0.004263
  },
  {
    "feature": "service_private",
    "importance": 0.004147
  },
  {
    "feature": "num_root",
    "importance": 0.003162
  },
  {
    "feature": "srv_count",
    "importance": 0.003077
  },
  {
    "feature": "service_ftp",
    "importance": 0.002936
  },
  {
    "feature": "serror_rate",
    "importance": 0.002804
  },
  {
    "feature": "rerror_rate",
    "importance": 0.002681
  },
  {
    "feature": "logged_in",
    "importance": 0.002438
  },
  {
    "feature": "dst_host_same_srv_rate",
    "importance": 0.001886
  },
  {
    "feature": "service_pm_dump",
    "importance": 0.001856
  },
  {
    "feature": "service_time",
    "importance": 0.001697
  },
  {
    "feature": "srv_rerror_rate",
    "importance": 0.001681
  },
  {
    "feature": "duration",
    "importance": 0.001648
  },
  {
    "feature": "dst_host_same_src_port_rate",
    "importance": 0.001565
  },
  {
    "feature": "protocol_type_tcp",
    "importance": 0.001368
  },
  {
    "feature": "service_finger",
    "importance": 0.001054
  },
  {
    "feature": "service_login",
    "importance": 0.000974
  },
  {
    "feature": "num_compromised",
    "importance": 0.000965
  },
  {
    "feature": "flag_S1",
    "importance": 0.00093
  },
  {
    "feature": "su_attempted",
    "importance": 0.000797
  },
  {
    "feature": "dst_host_srv_diff_host_rate",
    "importance": 0.000727
  },
  {
    "feature": "dst_host_srv_serror_rate",
    "importance": 0.000683
  },
  {
    "feature": "flag_REJ",
    "importance": 0.00053
  },
  {
    "feature": "same_srv_rate",
    "importance": 0.00053
  },
  {
    "feature": "service_X11",
    "importance": 0.000452
  },
  {
    "feature": "service_pop_2",
    "importance": 0.000431
  },
  {
    "feature": "flag_SF",
    "importance": 0.000348
  },
  {
    "feature": "service_auth",
    "importance": 0.000336
  },
  {
    "feature": "srv_serror_rate",
    "importance": 0.000268
  },
  {
    "feature": "flag_RSTO",
    "importance": 0.00023
  },
  {
    "feature": "dst_host_srv_rerror_rate",
    "importance": 0.000225
  },
  {
    "feature": "service_tim_i",
    "importance": 0.000194
  },
  {
    "feature": "num_shells",
    "importance": 0.000165
  },
  {
    "feature": "service_pop_3",
    "importance": 0.000113
  },
  {
    "feature": "srv_diff_host_rate",
    "importance": 0.000105
  },
  {
    "feature": "service_IRC",
    "importance": 7.2e-05
  },
  {
    "feature": "land",
    "importance": 5.4e-05
  },
  {
    "feature": "service_http_443",
    "importance": 3e-06
  },
  {
    "feature": "service_Z39_50",
    "importance": 0.0
  },
  {
    "feature": "service_aol",
    "importance": 0.0
  },
  {
    "feature": "service_bgp",
    "importance": 0.0
  },
  {
    "feature": "service_courier",
    "importance": 0.0
  },
  {
    "feature": "service_csnet_ns",
    "importance": 0.0
  },
  {
    "feature": "service_ctf",
    "importance": 0.0
  },
  {
    "feature": "service_daytime",
    "importance": 0.0
  },
  {
    "feature": "service_discard",
    "importance": 0.0
  },
  {
    "feature": "service_domain",
    "importance": 0.0
  },
  {
    "feature": "service_echo",
    "importance": 0.0
  },
  {
    "feature": "service_efs",
    "importance": 0.0
  },
  {
    "feature": "service_exec",
    "importance": 0.0
  },
  {
    "feature": "service_gopher",
    "importance": 0.0
  },
  {
    "feature": "service_harvest",
    "importance": 0.0
  },
  {
    "feature": "service_hostnames",
    "importance": 0.0
  },
  {
    "feature": "service_http_2784",
    "importance": 0.0
  },
  {
    "feature": "service_http_8001",
    "importance": 0.0
  },
  {
    "feature": "service_iso_tsap",
    "importance": 0.0
  },
  {
    "feature": "service_klogin",
    "importance": 0.0
  },
  {
    "feature": "service_kshell",
    "importance": 0.0
  },
  {
    "feature": "service_ldap",
    "importance": 0.0
  },
  {
    "feature": "service_link",
    "importance": 0.0
  },
  {
    "feature": "service_mtp",
    "importance": 0.0
  },
  {
    "feature": "service_name",
    "importance": 0.0
  },
  {
    "feature": "service_netbios_dgm",
    "importance": 0.0
  },
  {
    "feature": "service_netbios_ns",
    "importance": 0.0
  },
  {
    "feature": "service_netbios_ssn",
    "importance": 0.0
  },
  {
    "feature": "service_netstat",
    "importance": 0.0
  },
  {
    "feature": "service_nnsp",
    "importance": 0.0
  },
  {
    "feature": "service_nntp",
    "importance": 0.0
  },
  {
    "feature": "service_ntp_u",
    "importance": 0.0
  },
  {
    "feature": "service_printer",
    "importance": 0.0
  },
  {
    "feature": "service_red_i",
    "importance": 0.0
  },
  {
    "feature": "service_remote_job",
    "importance": 0.0
  },
  {
    "feature": "service_rje",
    "importance": 0.0
  },
  {
    "feature": "service_shell",
    "importance": 0.0
  },
  {
    "feature": "service_sql_net",
    "importance": 0.0
  },
  {
    "feature": "service_ssh",
    "importance": 0.0
  },
  {
    "feature": "service_sunrpc",
    "importance": 0.0
  },
  {
    "feature": "service_supdup",
    "importance": 0.0
  },
  {
    "feature": "service_systat",
    "importance": 0.0
  },
  {
    "feature": "service_tftp_u",
    "importance": 0.0
  },
  {
    "feature": "service_urh_i",
    "importance": 0.0
  },
  {
    "feature": "service_uucp",
    "importance": 0.0
  },
  {
    "feature": "service_uucp_path",
    "importance": 0.0
  },
  {
    "feature": "service_vmnet",
    "importance": 0.0
  },
  {
    "feature": "service_whois",
    "importance": 0.0
  },
  {
    "feature": "flag_OTH",
    "importance": 0.0
  },
  {
    "feature": "flag_S2",
    "importance": 0.0
  },
  {
    "feature": "flag_S3",
    "importance": 0.0
  },
  {
    "feature": "flag_SH",
    "importance": 0.0
  },
  {
    "feature": "num_outbound_cmds",
    "importance": 0.0
  },
  {
    "feature": "is_host_login",
    "importance": 0.0
  }
]

ProjectReport.md

### Top 5 Feature Importances (XGBoost)

1. `service_eco_i` (**19.39%**): ICMP Echo Request service.
2. `service_telnet` (**12.42%**): Remote terminal service.
3. `service_smtp` (**10.58%**): Mail service.
4. `flag_S0` (**8.50%**): SYN connection errors.
5. `dst_host_serror_rate` (**5.13%**): Destination host SYN error rate.